{
  "version": "1.5.0",
  "params": {
    "rho_max": 10,
    "alpha_tau": 3,
    "beta_C": 1,
    "D_C": 1,
    "lambda_C": 2,
    "w_grad_theta_q": 1000000,
    "w_C_q": 1000000,
    "w_budget_barrier_q": 0,
    "absorb_on_b0": true
  },
  "chain0_hex": "0000000000000000000000000000000000000000000000000000000000000000",
  "state0": {
    "rho": [[9, 10], [10, 9]],
    "theta": [[0, 0], [0, 0]],
    "C": [[0, 0], [0, 0]],
    "b": 3000000,
    "t": 0
  },
  "actions": [
    {
      "drho": [[2, 2], [2, 2]],
      "dtheta": [[1, 1], [1, 1]],
      "u_glyph": null
    },
    {
      "drho": [[1, 1], [1, 1]],
      "dtheta": [[1, 1], [1, 1]],
      "u_glyph": null
    },
    {
      "drho": [[0, 0], [0, 0]],
      "dtheta": [[1, 1], [1, 1]],
      "u_glyph": null
    }
  ]
}
